{
  "schema_version": "1.0",
  "run_metadata": {
    "run_id": "A2-BB-ARTICLE-LIFECYCLE-INT-R2",
    "feature_id": "article-lifecycle",
    "prompt_version": "v1.2",
    "revision": 2,
    "generated_at": "2026-06-02T12:02:00+08:00"
  },
  "coverage_items": [
    {
      "id": "CI-1",
      "requirement_ids": [
        "R1"
      ],
      "technique": "EP",
      "description": "Create authentication gate"
    },
    {
      "id": "CI-2",
      "requirement_ids": [
        "R2",
        "R3"
      ],
      "technique": "EP",
      "description": "Valid create path and response contract"
    },
    {
      "id": "CI-3",
      "requirement_ids": [
        "R4"
      ],
      "technique": "EP",
      "description": "Invalid create payload rejection"
    },
    {
      "id": "CI-4",
      "requirement_ids": [
        "R5"
      ],
      "technique": "EP",
      "description": "Owner update succeeds"
    },
    {
      "id": "CI-5",
      "requirement_ids": [
        "R6"
      ],
      "technique": "DT",
      "description": "Partial update and tagList decision combinations"
    },
    {
      "id": "CI-7",
      "requirement_ids": [
        "R8"
      ],
      "technique": "EP",
      "description": "Owner delete succeeds"
    },
    {
      "id": "CI-8",
      "requirement_ids": [
        "R9"
      ],
      "technique": "Scenario",
      "description": "Post-delete detail retrieval failure"
    },
    {
      "id": "CI-9",
      "requirement_ids": [
        "R10"
      ],
      "technique": "EP",
      "description": "Delete unauthorized/non-owner rejection"
    },
    {
      "id": "CI-10",
      "requirement_ids": [
        "R11"
      ],
      "technique": "Scenario",
      "description": "Update persistence observable through GET"
    },
    {
      "id": "CI-11",
      "requirement_ids": [
        "R12"
      ],
      "technique": "Scenario",
      "description": "Post-delete list observability checks"
    },
    {
      "id": "CI-13",
      "requirement_ids": [
        "R7",
        "R10"
      ],
      "technique": "EP",
      "description": "Unauthorized or non-owner update/delete negative partitions"
    },
    {
      "id": "CI-14",
      "requirement_ids": [
        "R12"
      ],
      "technique": "Scenario",
      "description": "Post-delete list observability checks across relevant list queries"
    }
  ],
  "equivalence_partitions": [
    {
      "id": "EP-1",
      "requirement_ids": [
        "R1"
      ],
      "description": "Missing auth token on create",
      "test_case_ids": [
        "TC-001"
      ]
    },
    {
      "id": "EP-2",
      "requirement_ids": [
        "R2"
      ],
      "description": "Valid create payload accepted",
      "test_case_ids": [
        "TC-002"
      ]
    },
    {
      "id": "EP-3",
      "requirement_ids": [
        "R3"
      ],
      "description": "Create response includes required fields",
      "test_case_ids": [
        "TC-003"
      ]
    },
    {
      "id": "EP-4",
      "requirement_ids": [
        "R2"
      ],
      "description": "Duplicate title still accepted",
      "test_case_ids": [
        "TC-004"
      ]
    },
    {
      "id": "EP-5",
      "requirement_ids": [
        "R4"
      ],
      "description": "Invalid create values rejected",
      "test_case_ids": [
        "TC-005",
        "TC-006",
        "TC-007"
      ]
    },
    {
      "id": "EP-8",
      "requirement_ids": [
        "R5"
      ],
      "description": "Owner update success",
      "test_case_ids": [
        "TC-008"
      ]
    },
    {
      "id": "EP-9",
      "requirement_ids": [
        "R6"
      ],
      "description": "Partial update preserves omitted fields",
      "test_case_ids": [
        "TC-009"
      ]
    },
    {
      "id": "EP-10",
      "requirement_ids": [
        "R8"
      ],
      "description": "Owner delete success",
      "test_case_ids": [
        "TC-014"
      ]
    },
    {
      "id": "EP-11",
      "requirement_ids": [
        "R7"
      ],
      "description": "Update rejected for unauthenticated or non-owner actor",
      "test_case_ids": [
        "TC-019"
      ]
    },
    {
      "id": "EP-12",
      "requirement_ids": [
        "R10"
      ],
      "description": "Delete rejected for unauthenticated or non-owner actor",
      "test_case_ids": [
        "TC-020"
      ]
    }
  ],
  "boundary_values": [
    {
      "id": "BVA-1",
      "requirement_ids": [
        "R2"
      ],
      "description": "Duplicate title boundary",
      "test_case_ids": [
        "TC-004"
      ]
    },
    {
      "id": "BVA-2",
      "requirement_ids": [
        "R4"
      ],
      "description": "Title empty vs non-empty",
      "test_case_ids": [
        "TC-005",
        "TC-002"
      ]
    },
    {
      "id": "BVA-3",
      "requirement_ids": [
        "R4"
      ],
      "description": "Description empty vs non-empty",
      "test_case_ids": [
        "TC-006",
        "TC-002"
      ]
    },
    {
      "id": "BVA-4",
      "requirement_ids": [
        "R4"
      ],
      "description": "Body empty vs non-empty",
      "test_case_ids": [
        "TC-007",
        "TC-002"
      ]
    },
    {
      "id": "BVA-5",
      "requirement_ids": [
        "R6"
      ],
      "description": "tagList empty array boundary",
      "test_case_ids": [
        "TC-011"
      ]
    },
    {
      "id": "BVA-6",
      "requirement_ids": [
        "R6"
      ],
      "description": "tagList null boundary",
      "test_case_ids": [
        "TC-012"
      ]
    }
  ],
  "decision_tables": [
    {
      "id": "DT-1",
      "requirement_ids": [
        "R6"
      ],
      "conditions": [
        "tagList omitted",
        "tagList = []",
        "tagList = null",
        "tagList = non-empty array"
      ],
      "rules": [
        {
          "rule": "omit",
          "expected": "preserve existing tags",
          "test_case_id": "TC-010"
        },
        {
          "rule": "empty-array",
          "expected": "clear all tags",
          "test_case_id": "TC-011"
        },
        {
          "rule": "null",
          "expected": "reject request",
          "test_case_id": "TC-012"
        },
        {
          "rule": "replace",
          "expected": "replace tags",
          "test_case_id": "TC-013"
        }
      ]
    }
  ],
  "test_scenarios": [
    {
      "id": "SC-01",
      "requirement_ids": [
        "R1"
      ],
      "type": "Negative",
      "priority": "High",
      "title": "Unauthenticated create rejected"
    },
    {
      "id": "SC-02",
      "requirement_ids": [
        "R2"
      ],
      "type": "Happy Path",
      "priority": "High",
      "title": "Valid create succeeds"
    },
    {
      "id": "SC-03",
      "requirement_ids": [
        "R3"
      ],
      "type": "Happy Path",
      "priority": "Medium",
      "title": "Create response completeness"
    },
    {
      "id": "SC-04",
      "requirement_ids": [
        "R2"
      ],
      "type": "Boundary",
      "priority": "Medium",
      "title": "Duplicate title behavior"
    },
    {
      "id": "SC-05",
      "requirement_ids": [
        "R4"
      ],
      "type": "Negative",
      "priority": "High",
      "title": "Invalid create payload rejected"
    },
    {
      "id": "SC-08",
      "requirement_ids": [
        "R5",
        "R6"
      ],
      "type": "Happy Path",
      "priority": "High",
      "title": "Owner update and partial update"
    },
    {
      "id": "SC-09",
      "requirement_ids": [
        "R6"
      ],
      "type": "State",
      "priority": "High",
      "title": "tagList decision combinations"
    },
    {
      "id": "SC-10",
      "requirement_ids": [
        "R11"
      ],
      "type": "State",
      "priority": "Medium",
      "title": "Update persistence"
    },
    {
      "id": "SC-11",
      "requirement_ids": [
        "R8"
      ],
      "type": "Happy Path",
      "priority": "High",
      "title": "Owner delete success"
    },
    {
      "id": "SC-12",
      "requirement_ids": [
        "R9"
      ],
      "type": "State",
      "priority": "Medium",
      "title": "Post-delete detail not found"
    },
    {
      "id": "SC-13",
      "requirement_ids": [
        "R7"
      ],
      "type": "Negative",
      "priority": "High",
      "title": "Unauthorized/non-owner update rejected"
    },
    {
      "id": "SC-14",
      "requirement_ids": [
        "R10"
      ],
      "type": "Negative",
      "priority": "High",
      "title": "Unauthorized/non-owner delete rejected"
    },
    {
      "id": "SC-15",
      "requirement_ids": [
        "R12"
      ],
      "type": "State",
      "priority": "High",
      "title": "Deleted article absent from detail and list endpoints"
    }
  ],
  "test_cases": [
    {
      "id": "TC-001",
      "title": "Reject unauthenticated create",
      "requirement_ids": [
        "R1"
      ],
      "priority": "High",
      "steps": [
        "POST /articles without Authorization header"
      ],
      "expected_result": "Request is rejected as unauthorized"
    },
    {
      "id": "TC-002",
      "title": "Create article with valid payload",
      "requirement_ids": [
        "R2"
      ],
      "priority": "High",
      "steps": [
        "POST /articles with valid token and non-empty title/description/body"
      ],
      "expected_result": "HTTP 201 and created article object returned"
    },
    {
      "id": "TC-003",
      "title": "Verify create response fields",
      "requirement_ids": [
        "R3"
      ],
      "priority": "Medium",
      "steps": [
        "Inspect successful create response payload"
      ],
      "expected_result": "Response includes required article identity, content, and author metadata"
    },
    {
      "id": "TC-004",
      "title": "Duplicate title unique slug",
      "requirement_ids": [
        "R2",
        "R3"
      ],
      "priority": "Medium",
      "steps": [
        "Create two articles with identical title"
      ],